{
  "sampleId": "f972dc2b-60c5-411d-b0ec-c89d398bc9d2",
  "sessionId": "mob_session_7b7c6d325d234be7b6cba379ad12c659",
  "exerciseSessionId": "exercise_session_17b70728c8a54338b28a45b40c83092c",
  "setId": "mob_set_34599d14fb234ff2837ad7dc453ec21a",
  "phase": "SET",
  "sensorType": "HEART_RATE",
  "value": 140,
  "unit": "BPM",
  "timestamp": 1784102580000,
  "source": "WATCH",
  "valid": true,
  "quality": "GOOD"
}
